{
  "caveats": [
    "Low surrogate count: suitable for CI smoke, not final evidence."
  ],
  "claim_id": "demo_henon_nonlinear_structure",
  "evidence": {
    "surrogate_test": {
      "alpha": 0.05,
      "original_statistic": 0.6704736455669389,
      "p_value": 0.05,
      "rejected": true,
      "surrogate_statistics": [
        0.08382540533620803,
        0.04056271955050321,
        0.07920523355475653,
        0.08038082198844737,
        0.1111383487663741,
        0.14413256579593683,
        0.11109485703595519,
        0.06747380532297313,
        0.09515495008159497,
        0.06876068960293331,
        0.08926764847231777,
        0.07346759376491034,
        0.08912583120543197,
        0.06056249879761799,
        0.06223795428447586,
        0.10237263431580035,
        0.08747113980941415,
        0.11512796239798379,
        0.04429981485194484
      ]
    }
  },
  "leakage_flags": {},
  "original_statistic": 0.6704736455669389,
  "p_value": 0.05,
  "surrogate_max": 0.14413256579593683,
  "surrogate_min": 0.04056271955050321,
  "verdict": "SURVIVED"
}